{
  "schema_version": "1.0.0",
  "extraction_run_id": "run-nonfood-001",
  "document_id": "doc-nonfood-001",
  "import_batch_id": null,
  "correlation_id": "corr-nonfood-001",
  "status": "completed",
  "extractor": {"extractor_name": "contract-fixture", "extractor_version": "1.0.0", "parser_profile": null, "parser_version": null, "ocr_engine": null, "ocr_version": null, "layout_engine": null, "layout_version": null, "ai_fallback_provider": null, "ai_fallback_model": null, "started_at": "2026-08-23T12:00:00Z", "completed_at": "2026-08-23T12:00:01Z", "duration_ms": 1000},
  "document_analysis": {"detected_provider_type": "meeting_beo", "page_count": 1, "text_mode": "text_native", "ocr_used": false, "languages": ["en"], "overall_confidence": 0.96, "sha256": "bbbbbbbbbbbbbbbbbbbbbbbbbbbbbbbbbbbbbbbbbbbbbbbbbbbbbbbbbbbbbbbb", "source_filename": "meeting.pdf"},
  "pages": [{"page_number": 1, "page_type": "EVENT_ORDER", "detected_event_order_number": "M-100", "confidence": 0.98, "text_available": true, "ocr_used": false, "source_trace": {"document_id": "doc-nonfood-001", "page_numbers": [1], "source_text": "M-100 Office Meeting", "confidence": 0.98, "extraction_method": "text"}, "warnings": []}],
  "event_orders": [{"source_key": "eo:M-100", "event_order_number": "M-100", "quote_number": null, "folio_number": null, "organization": "Operations", "program_name": "Office Meeting", "event_date": "2026-09-12", "property_name": null, "location_text": "Boardroom", "revision": {"kind": "original", "number": 0, "raw_label": null, "is_revised": false, "confidence": 0.98, "source_trace": {"document_id": "doc-nonfood-001", "page_numbers": [1], "source_text": "Original", "confidence": 0.98, "extraction_method": "text"}}, "source_pages": [1], "functions": [{"source_key": "eo:M-100:function:1", "source_function_name": "Office Meeting", "normalized_type": "meeting", "post_as": null, "start_time": "09:00", "end_time": "10:00", "start_datetime": null, "end_datetime": null, "source_location_text": "Boardroom", "venue_candidates": [], "attendance": {"expected_count": 12, "guaranteed_count": null, "set_count": null}, "menu": {"status": "none", "source_title": null, "sections": [], "raw_text": null, "confidence": 0.98, "source_trace": {"document_id": "doc-nonfood-001", "page_numbers": [1], "source_text": "No food service", "confidence": 0.98, "extraction_method": "text"}}, "dietary_requirements": [], "operational_instructions": [], "staffing": [], "setup": [], "av": [], "attachments": [], "relevance_signals": {"has_food": false, "has_beverage": false, "has_kitchen_production_signal": false, "has_dietary_requirements": false, "has_service_requirements": false, "has_setup": false, "has_av": false, "has_staffing": false, "suggested_categories": ["meeting"]}, "source_trace": {"document_id": "doc-nonfood-001", "page_numbers": [1], "source_text": "Office Meeting", "confidence": 0.96, "extraction_method": "text"}, "confidence": 0.96}], "references": [], "attachments": [], "source_trace": {"document_id": "doc-nonfood-001", "page_numbers": [1], "source_text": "M-100", "confidence": 0.98, "extraction_method": "text"}, "confidence": 0.97}],
  "issues": [], "warnings": [], "unresolved_items": [], "processing": {"started_at": "2026-08-23T12:00:00Z", "completed_at": "2026-08-23T12:00:01Z", "duration_ms": 1000}
}
