{
  "schema_version": "1.0.0",
  "extraction_run_id": "run-tbd-001",
  "document_id": "doc-tbd-001",
  "import_batch_id": null,
  "correlation_id": "corr-tbd-001",
  "status": "completed",
  "extractor": {"extractor_name": "contract-fixture", "extractor_version": "1.0.0", "parser_profile": null, "parser_version": null, "ocr_engine": null, "ocr_version": null, "layout_engine": null, "layout_version": null, "ai_fallback_provider": null, "ai_fallback_model": null, "started_at": "2026-08-23T12:00:00Z", "completed_at": "2026-08-23T12:00:01Z", "duration_ms": 1000},
  "document_analysis": {"detected_provider_type": "beo", "page_count": 1, "text_mode": "mixed", "ocr_used": true, "languages": ["en"], "overall_confidence": 0.74, "sha256": "cccccccccccccccccccccccccccccccccccccccccccccccccccccccccccccccc", "source_filename": "menu-tbd.pdf"},
  "pages": [{"page_number": 1, "page_type": "EVENT_ORDER", "detected_event_order_number": "T-100", "confidence": 0.9, "text_available": true, "ocr_used": true, "source_trace": {"document_id": "doc-tbd-001", "page_numbers": [1], "source_text": "Menu TBD", "confidence": 0.9, "extraction_method": "ocr"}, "warnings": ["Menu will be confirmed later"]}],
  "event_orders": [{"source_key": "eo:T-100", "event_order_number": "T-100", "quote_number": null, "folio_number": null, "organization": null, "program_name": "Dinner", "event_date": "2026-09-13", "property_name": null, "location_text": "Ballroom", "revision": {"kind": "unknown", "number": null, "raw_label": null, "is_revised": false, "confidence": 0.7, "source_trace": {"document_id": "doc-tbd-001", "page_numbers": [1], "source_text": "Revision not shown", "confidence": 0.7, "extraction_method": "ocr"}}, "source_pages": [1], "functions": [{"source_key": "eo:T-100:function:1", "source_function_name": "Dinner", "normalized_type": "meal", "post_as": "dinner", "start_time": "18:00", "end_time": "20:00", "start_datetime": null, "end_datetime": null, "source_location_text": "Ballroom", "venue_candidates": [], "attendance": {"expected_count": 100, "guaranteed_count": 100, "set_count": 100}, "menu": {"status": "tbd", "source_title": "Dinner menu", "sections": [], "raw_text": "TBD", "confidence": 0.99, "source_trace": {"document_id": "doc-tbd-001", "page_numbers": [1], "source_text": "Menu TBD", "confidence": 0.99, "extraction_method": "ocr"}}, "dietary_requirements": [], "operational_instructions": [], "staffing": [], "setup": [], "av": [], "attachments": [], "relevance_signals": {"has_food": true, "has_beverage": false, "has_kitchen_production_signal": true, "has_dietary_requirements": false, "has_service_requirements": false, "has_setup": false, "has_av": false, "has_staffing": false, "suggested_categories": ["food"]}, "source_trace": {"document_id": "doc-tbd-001", "page_numbers": [1], "source_text": "Dinner menu TBD", "confidence": 0.85, "extraction_method": "ocr"}, "confidence": 0.85}], "references": [], "attachments": [], "source_trace": {"document_id": "doc-tbd-001", "page_numbers": [1], "source_text": "T-100 Dinner", "confidence": 0.9, "extraction_method": "ocr"}, "confidence": 0.86}],
  "issues": [], "warnings": [], "unresolved_items": [], "processing": {"started_at": "2026-08-23T12:00:00Z", "completed_at": "2026-08-23T12:00:01Z", "duration_ms": 1000}
}
